### ISSUE TITLE
Pull All task always hangs before 100%

### ISSUE THREAD

**Issue by hjklz** [MISP/MISP#2051]
### Work environment

| Questions                 | Answers
|---------------------------|--------------------
| Type of issue             | Bug
| OS version (server)       |  CentOS
| OS version (client)       | 7
| PHP version               | 5.6
| MISP version / git hash   | 2.4.67
| Browser                   | If applicable

### Expected behavior
Pull All task in Administration -> Jobs reaches 100%

### Actual behavior
The job hangs and stops before reaching 100%

### Steps to reproduce the behavior
Wait for pull all scheduled task to run or click pull all on any remote server

### Logs, screenshots, configuration dump, ...
The worker log shows many main.INFO for a while and then ends on the ERROR getaddrinfo as seen below.

It may just be a flaky connection on my end, but since it happens so consistently I am not sure if that is truly the case.

Thanks.

[2017-03-15 08:38:51] main.INFO: Processing ID:abae4cc2827b4c294ac1211a6e3316f4 in default {"type":"process","worker":"misp:1830","job_id":"abae4cc2827b4c294ac1211a6e3316f4"} []
[2017-03-15 08:39:26] main.ERROR: {"queue":"default","id":"abae4cc2827b4c294ac1211a6e3316f4","class":"ServerShell","args":[["pull","3","1","full","1375"]]} failed: php_network_getaddresses: getaddrinfo failed: Name or service not known {"type":"fail","log":"php_network_getaddresses: getaddrinfo failed: Name or service not known","job_id":"abae4cc2827b4c294ac1211a6e3316f4","time":34571,"worker":"misp:1830"} []

**Comment by adulau** [comment]
~~~~
"failed: php_network_getaddresses: getaddrinfo failed: Name or service not known" 
~~~~ 

It seems that your DNS resolver is not working. Have you check your DNS configuration or the hostname (mistyped?)?

**Comment by hjklz** [comment]
Yes, DNS appears to be working - dig google.ca returned expected results.
[root@misp ~]# dig google.ca

; <<>> DiG 9.9.4-RedHat-9.9.4-38.el7_3.2 <<>> google.ca
;; global options: +cmd
;; Got answer:
;; ->>HEADER<<- opcode: QUERY, status: NOERROR, id: 2975
;; flags: qr rd ra; QUERY: 1, ANSWER: 1, AUTHORITY: 0, ADDITIONAL: 1

;; OPT PSEUDOSECTION:
; EDNS: version: 0, flags:; udp: 4096
;; QUESTION SECTION:
;google.ca.                     IN      A

;; ANSWER SECTION:
google.ca.              262     IN      A       216.58.216.131

;; Query time: 10 msec
;; SERVER: 192.168.1.254#53(192.168.1.254)
;; WHEN: Wed Mar 15 11:04:23 CDT 2017
;; MSG SIZE  rcvd: 54

 I am not sure what you mean by hostname mistyped. As I said above the pulling works for a while then hangs, if the DNS or hostname were wrong wouldn't it just not work at all? I am not the most confident on my networking knowledge...

**Comment by adulau** [comment]
Maybe the best would be look at your DNS requests when doing the pull and using tcpdump:

~~~~
tcpdump -n port 53
~~~~

**Comment by hjklz** [comment]
11:44:15.311299 IP 192.168.1.51.43213 > 192.168.1.254.domain: 47763+ A? remote server (36)
11:44:15.313463 IP 192.168.1.254.domain > 192.168.1.51.43213: 47763- 1/0/0 A remote server (52)
11:44:15.313647 IP 192.168.1.51.34328 > 192.168.1.254.domain: 63892+ AAAA? remote server (36)
11:44:15.314989 IP 192.168.1.254.domain > 192.168.1.51.34328: 63892- 1/0/0 (36)
11:44:16.649257 IP 192.168.1.51.43633 > 192.168.1.254.domain: 37046+ A? remote server (36)
11:44:21.654656 IP 192.168.1.51.43633 > 192.168.1.254.domain: 37046+ A? remote server (36)
11:44:26.660418 IP 192.168.1.51.55303 > 192.168.1.254.domain: 39123+ A? remote server (41)
11:44:26.671018 IP 192.168.1.254.domain > 192.168.1.51.55303: 39123 NXDomain 0/1/0 (116)
11:44:26.671344 IP 192.168.1.51.60486 > 192.168.1.254.domain: 13788+ AAAA? remote server (41)
11:44:26.679498 IP 192.168.1.254.domain > 192.168.1.51.60486: 13788 NXDomain 0/1/0 (116)

Here is last few requests before the job hanged. remote server is the base url of the remote server, hidden for privacy. It appears I get non existent domain at the end.

**Comment by adulau** [comment]
Could you test again (with a recent version)?

We will close the issue. Feel free to reopen the issue if the issue persists.
