### ISSUE TITLE
 SSL: Broken pipe in CakeSocket.php

### ISSUE THREAD

**Issue by Just-Me-666** [MISP/MISP#5243]
### Work environment

| Questions                 | Answers
|---------------------------|--------------------
| Type of issue             | Question
| OS version (server)       | CentOS
| OS version (client)       | Windows 10
| PHP version               | 7.2
| MISP version / git hash   | v2.4.116 
| Browser                   | Firefox 

### Expected behavior
Establishing a connection to a remote server via proxy and push/pull events via proxy.

### Actual behavior
The connection to a server cannot be established, therefor the push/pull events does not work. Not even the Diagnostics test for proxy is successful.  
The proxy on the server works, since the complete MISP install was made via proxy.

### Steps to reproduce the behavior
Enter the proxy and try to run the server connection test.

### Logs, screenshots, configuration dump, ...
Proxy settings (we dont use  authentication):
  'Proxy' =>
  array (
    'host' => '[PROXY]',
    'port' => 8080,
    'method' => '',
    'user' => '',
    'password' => '',
  ),

Diagnostic info:
Proxy settings…Getting URL via proxy failed

From error.log:
Warning: Warning (2): stream_socket_enable_crypto() [<a href='http://php.net/function.stream-socket-enable-crypto'>function.stream-socket-enable-crypto</a>]: SSL: Broken pipe in [/var/www/MISP/app/Lib/cakephp/lib/Cake/Network/CakeSocket.php, line 490]
Trace:
ErrorHandler::handleError() - APP/Lib/cakephp/lib/Cake/Error/ErrorHandler.php, line 230
stream_socket_enable_crypto - [internal], line ??
CakeSocket::enableCrypto() - APP/Lib/cakephp/lib/Cake/Network/CakeSocket.php, line 490
CakeSocket::connect() - APP/Lib/cakephp/lib/Cake/Network/CakeSocket.php, line 247
CakeSocket::write() - APP/Lib/cakephp/lib/Cake/Network/CakeSocket.php, line 386
HttpSocket::request() - APP/Lib/cakephp/lib/Cake/Network/Http/HttpSocket.php, line 377
HttpSocket::get() - APP/Lib/cakephp/lib/Cake/Network/Http/HttpSocket.php, line 464
Server::proxyDiagnostics() - APP/Model/Server.php, line 4425
ServersController::serverSettings() - APP/Controller/ServersController.php, line 1051
ReflectionMethod::invokeArgs() - [internal], line ??
Controller::invokeAction() - APP/Lib/cakephp/lib/Cake/Controller/Controller.php, line 499
Dispatcher::_invoke() - APP/Lib/cakephp/lib/Cake/Routing/Dispatcher.php, line 193
Dispatcher::dispatch() - APP/Lib/cakephp/lib/Cake/Routing/Dispatcher.php, line 167
[main] - APP/webroot/index.php, line 92

The output when trying server connection:
Connection test: Server unreachable

From Audit --> List Logs
Error: Connection test failed. Reason: "Unable to perform enableCrypto operation on CakeSocket" 

From error.log:
Warning: Warning (2): stream_socket_enable_crypto(): SSL: Broken pipe in [/var/www/MISP/app/Lib/cakephp/lib/Cake/Network/CakeSocket.php, line 490]
Trace:
ErrorHandler::handleError() - APP/Lib/cakephp/lib/Cake/Error/ErrorHandler.php, line 230
stream_socket_enable_crypto - [internal], line ??
CakeSocket::enableCrypto() - APP/Lib/cakephp/lib/Cake/Network/CakeSocket.php, line 490
CakeSocket::connect() - APP/Lib/cakephp/lib/Cake/Network/CakeSocket.php, line 247
CakeSocket::write() - APP/Lib/cakephp/lib/Cake/Network/CakeSocket.php, line 386
HttpSocket::request() - APP/Lib/cakephp/lib/Cake/Network/Http/HttpSocket.php, line 377
HttpSocket::get() - APP/Lib/cakephp/lib/Cake/Network/Http/HttpSocket.php, line 464
Server::runConnectionTest() - APP/Model/Server.php, line 3929
ServersController::testConnection() - APP/Controller/ServersController.php, line 1465
ReflectionMethod::invokeArgs() - [internal], line ??
Controller::invokeAction() - APP/Lib/cakephp/lib/Cake/Controller/Controller.php, line 499
Dispatcher::_invoke() - APP/Lib/cakephp/lib/Cake/Routing/Dispatcher.php, line 193
Dispatcher::dispatch() - APP/Lib/cakephp/lib/Cake/Routing/Dispatcher.php, line 167
[main] - APP/webroot/index.php, line 92

The Certificate was created as stated in misp install instructions.

**Comment by Just-Me-666** [comment]
Any idea on this? I can't get this to work via proxy (and it has to work via proxy). Trying curl on remote server and also works through proxy, but misp does not.

**Comment by RichieB2B** [comment]
Can you run a tcpdump on the MISP server as this error occurs? It will give a clue what CakePHP is doing wrong.

**Comment by ancailliau** [comment]
It has to be a configuration issue. I'm running MISP behind a proxy with a similar configuration and sync with other servers. 

What is the configuration of the sync server?

**Comment by Just-Me-666** [comment]
So the thing is: we have two misp instances on two servers. One MISP is installed on internal network (INT) and one instance is installed in DMZ. INT and DMZ both go through the same proxy.
The misp in INT was installed with version v2.4.114 (version on time of install) and was updated to v2.4.116. For testing purposes i tested the sync to remote misp server via proxy on INT misp and the sync woks. But it does not work on misp installed in DMZ (installed directly the v2.4.116).
Both curl and opensll on DMZ server to remote misp works.

**Comment by RichieB2B** [comment]
Check with tcpdump what is going wrong on the network. CakePHP is not very verbose in logging SSL errors.

**Comment by ancailliau** [comment]
@Just-Me-666 Do you have logs on the proxy from DMZ instance and/or github.com? Does the DMZ instance reach the proxy?

**Comment by Just-Me-666** [comment]
Yes, the DMZ instance reaches the proxy. This is form tcpdump, the connection ends when proxy returns a Reset flag to DMZ server. So my guess is that the proxy is blocking the connection to remote misp, but the network guy says that on proxy logs he can see that dmz server has reached its destination. I don't know why would proxy block the traffic, if curl and openssl towards remote server works?

07:27:39.402160 IP BROWSER_WebApp.50362 > MISP_DMZ.https: Flags [S], seq 842353955, win 64240, options [mss 1460,nop,wscale 8,nop,nop,sackOK], length 0
07:27:39.402204 IP MISP_DMZ.https > BROWSER_WebApp.50362: Flags [S.], seq 2743690004, ack 842353956, win 29200, options [mss 1460,nop,nop,sackOK,nop,wscale 7], length 0
07:27:39.402724 IP BROWSER_WebApp.50362 > MISP_DMZ.https: Flags [.], ack 1, win 1026, length 0
07:27:39.404218 IP BROWSER_WebApp.50362 > MISP_DMZ.https: Flags [P.], seq 1:518, ack 1, win 1026, length 517
07:27:39.404249 IP MISP_DMZ.https > BROWSER_WebApp.50362: Flags [.], ack 518, win 237, length 0
07:27:39.416095 IP MISP_DMZ.https > BROWSER_WebApp.50362: Flags [P.], seq 1:2147, ack 518, win 237, length 2146
07:27:39.417149 IP BROWSER_WebApp.50362 > MISP_DMZ.https: Flags [.], ack 2147, win 1026, length 0
07:27:39.421210 IP BROWSER_WebApp.50362 > MISP_DMZ.https: Flags [P.], seq 518:644, ack 2147, win 1026, length 126
07:27:39.421482 IP MISP_DMZ.htps > BROWSER_WebApp.50362: Flags [P.], seq 2147:2198, ack 644, win 237, length 51
07:27:39.478359 IP BROWSER_WebApp.50362 > MISP_DMZ.https: Flags [.], ack 2198, win 1026, length 0
07:27:39.583997 IP BROWSER_WebApp.50362 > MISP_DMZ.https: Flags [P.], seq 644:1126, ack 2198, win 1026, length 482
07:27:39.610281 IP MISP_DMZ.60551 > DNS_SERVER.domain: 31787+ A? PROXY. (36)
07:27:39.610329 IP MISP_DMZ.60551 > DNS_SERVER.domain: 14394+ AAAA? PROXY. (36)
07:27:39.610600 IP DNS_SERVER.domain > MISP_DMZ.60551: 31787 2/3/3 A PROXY_1, A PROXY_2 (182)
07:27:39.610689 IP DNS_SERVER.domain > MISP_DMZ.60551: 14394 0/1/0 (91)
07:27:39.610824 IP MISP_DMZ.52684 > PROXY_1.webcache: Flags [S], seq 2042915569, win 29200, options [mss 1460,sackOK,TS val 2640894616 ecr 0,nop,wscale 7], length 0
07:27:39.612754 IP PROXY_1.webcache > MISP_DMZ.52684: Flags [S.], seq 996092787, ack 2042915570, win 14600, options [mss 1460,nop,nop,sackOK,nop,wscale 7], length 0
07:27:39.612782 IP MISP_DMZ.52684 > PROXY_1.webcache: Flags [.], ack 1, win 229, length 0
07:27:39.612807 IP MISP_DMZ.52684 > PROXY_1.webcache: Flags [P.], seq 1:87, ack 1, win 229, length 86: HTTP: CONNECT misp.remote:443 HTTP/1.1
07:27:39.613287 IP PROXY_1.webcache > MISP_DMZ.52684: Flags [R], seq 996092788, win 0, length 0

**Comment by RichieB2B** [comment]
Looks like a problem on the proxy. Do the tcpdump with curl and see if you can spot the difference. With the -A flag you see the actual content of the packets.

**Comment by Just-Me-666** [comment]
The content of the packet is encrypted. I tried decrypting it using the misp_private.key, but it's not decrypting.

**Comment by Just-Me-666** [comment]
After reviewing the tcpdump again i found below error when the RST flag is set. So is this RST related to misp application?

	Source: PROXY_1
    Destination: MISP_DMZ
	Transmission Control Protocol, Src Port: http-alt (8080), Dst Port: 51070 (51070), Seq: 1, Len: 0
    Source port: http-alt (8080)
    Destination port: 51070 (51070)
    [Stream index: 1]
    Sequence number: 1    (relative sequence number)

    Acknowledgment Number: 0xbecb3d96 [should be 0x00000000 because ACK flag is not set]
        [Expert Info (Warn/Protocol): Acknowledgment number: Broken TCP. The acknowledge field is nonzero while the ACK flag is not set]
            [Message: Acknowledgment number: Broken TCP. The acknowledge field is nonzero while the ACK flag is not set]
            [Severity level: Warn]
            [Group: Protocol]
    Header length: 20 bytes
    Flags: 0x004 (RST)
        000. .... .... = Reserved: Not set
        ...0 .... .... = Nonce: Not set
        .... 0... .... = Congestion Window Reduced (CWR): Not set
        .... .0.. .... = ECN-Echo: Not set
        .... ..0. .... = Urgent: Not set
        .... ...0 .... = Acknowledgment: Not set
        .... .... 0... = Push: Not set
        .... .... .1.. = Reset: Set
            [Expert Info (Chat/Sequence): Connection reset (RST)]
                [Message: Connection reset (RST)]

**Comment by RichieB2B** [comment]
It’s not about the encrypted TLS data but the HTTP request sent to the proxy by cURL. 
`CONNECT misp.remote:443 HTTP/1.1` sent by MISP looks correct but maybe cURL is doing something else because it works ok?

**Comment by Just-Me-666** [comment]
This is http from misp and curl:

DMZ_MISP
    Hypertext Transfer Protocol
    CONNECT misp.remote:443 HTTP/1.1\r\n
        [Expert Info (Chat/Sequence): CONNECT misp.remote:443 HTTP/1.1\r\n]
            [Message: CONNECT misp.remote:443 HTTP/1.1\r\n]
            [Severity level: Chat]
            [Group: Sequence]
        Request Method: CONNECT
        Request URI: misp.remote:443
        Request Version: HTTP/1.1
    Host: PROXY\r\n
    User-Agent: php proxy\r\n
    \r\n
    [Full request URI: http://PROXYmisp.remote:443]
    [HTTP request 1/1]


CURL from DMZ
    Hypertext Transfer Protocol
    CONNECT misp.remote:443 HTTP/1.1\r\n
        [Expert Info (Chat/Sequence): CONNECT misp.remote:443 HTTP/1.1\r\n]
            [Message: CONNECT misp.remote:443 HTTP/1.1\r\n]
            [Severity level: Chat]
            [Group: Sequence]
        Request Method: CONNECT
        Request URI: misp.remote:443
        Request Version: HTTP/1.1
    Host: misp.remote:443\r\n
    User-Agent: curl/7.29.0\r\n
    Proxy-Connection: Keep-Alive\r\n
    \r\n
    [Full request URI: http://misp.remote:443misp.remote:443]
    [HTTP request 1/1]

And from INT_MISP where the connection to remote misp works:
  Hypertext Transfer Protocol
    CONNECT misp.remote:443 HTTP/1.1\r\n
        [Expert Info (Chat/Sequence): CONNECT misp.remote:443 HTTP/1.1\r\n]
            [Message: CONNECT misp.remote:443 HTTP/1.1\r\n]
            [Severity level: Chat]
            [Group: Sequence]
        Request Method: CONNECT
        Request URI: misp.remote:443
        Request Version: HTTP/1.1
    Host: PROXY\r\n
    User-Agent: php proxy\r\n
    \r\n
    [Full request URI: http://PROXYmisp.remote:443]
    [HTTP request 1/1]

**Comment by RichieB2B** [comment]
Since the above shows INT_MISP and DMZ_MISP produce exactly the same network traffic the logical conclusion is a difference at the proxy side. Why is it sending a RST to the DMZ_MISP? Is there anything in the logs of the proxy server?

**Comment by ancailliau** [comment]
@just-me-666 could you please state what was the issue for future reference. It might also help other future user in understanding how to fix their issue. Last it might point out area where MISP can improve error reporting.

**Comment by Just-Me-666** [comment]
The issue is still not resolved, the sync via dmz to remote server is still not working. I just closed the issue, so it's not hanging open until we find a proper solution. When we resolve the issue, i will post an update of the solution.
